{
  "active_reference_ids": [
    "pcqm-k1-v4-100k-reference-s42"
  ],
  "available_actions": [
    "RUN_BOUNDED_RELATION_STUDY",
    "DEFER"
  ],
  "budget_snapshot_ref": "experiments/pcqm_k1_relation_resolution_100k/budget_snapshot.json",
  "chosen_action": "RUN_BOUNDED_RELATION_STUDY",
  "known_evidence_ids": [
    "pcqm-gptrans-pair-prenorm-500k-partial-s42",
    "pcqm-gptrans-shortest-path-profile-122484011",
    "pcqm-gptrans-step-profile-122499114",
    "pcqm-gptrans-t-500k-partial-reference-s42",
    "pcqm-k1-500k-paired-v3-scalar-reference",
    "pcqm-k1-chem-typed-pair-token-100k-s42",
    "pcqm-k1-conjugated-oneshot-100k-s42",
    "pcqm-k1-conjugated-persistent-100k-s42",
    "pcqm-k1-degree-balance-100k-s42",
    "pcqm-k1-functional-group-token-100k-s42",
    "pcqm-k1-linear-attention-100k-s42",
    "pcqm-k1-linear-attention-post100k-audit-s42",
    "pcqm-k1-linear-attention-post100k-audit-s42-recovery",
    "pcqm-k1-mose-context-gate-100k-s42",
    "pcqm-k1-mose-hidden-bn-100k-s42",
    "pcqm-k1-mose-replacement-100k-s42",
    "pcqm-k1-mose-residual-gate-100k-s42",
    "pcqm-k1-multiplicative-pair-value-100k-s42",
    "pcqm-k1-oneshot-triplet-pair-token-100k-s42",
    "pcqm-k1-pair-token-100k-s42",
    "pcqm-k1-pair-token-500k-s42",
    "pcqm-k1-pair-token-batch-profile-122388380",
    "pcqm-k1-pair-token-frozen-cross-scale-20260924",
    "pcqm-k1-pair-token-mose-100k-s42",
    "pcqm-k1-pair-token-node-return-100k-s42",
    "pcqm-k1-pairtoken-combination-transfer-20260923",
    "pcqm-k1-rwse-refresh-100k-s42",
    "pcqm-k1-sparse-triplet-100k-s42",
    "pcqm-k1-spd-pair-token-100k-s42",
    "pcqm-k1-tf32-a100-paired-s42",
    "pcqm-k1-topology-portability-post100k-audit-s42",
    "pcqm-k1-v4-100k-reference-s42",
    "v5-legacy-evidence-migration-2026-09-17"
  ],
  "known_trajectory_ids": [
    "TB-gptrans-pair-prenorm-500k-s42",
    "TB-k1-pair-token-500k-s42",
    "TC-gptrans-shortest-path-profile-v5",
    "TC-gptrans-step-profile-v5",
    "TC-k1-chem-typed-pair-token-100k-s42",
    "TC-k1-conjugated-oneshot-100k-s42",
    "TC-k1-conjugated-persistent-100k-s42",
    "TC-k1-degree-balance-100k-s42",
    "TC-k1-functional-group-token-100k-s42",
    "TC-k1-linear-attention-100k-s42",
    "TC-k1-linear-attention-post100k-audit-s42",
    "TC-k1-linear-attention-post100k-audit-s42-recovery",
    "TC-k1-mose-context-gate-100k-s42",
    "TC-k1-mose-hidden-bn-100k-s42",
    "TC-k1-mose-replacement-100k-s42",
    "TC-k1-mose-residual-gate-100k-s42",
    "TC-k1-multiplicative-pair-value-100k-s42",
    "TC-k1-oneshot-triplet-pair-token-100k-s42",
    "TC-k1-pair-token-100k-s42",
    "TC-k1-pair-token-batch-profile",
    "TC-k1-pair-token-frozen-cross-scale-20260924",
    "TC-k1-pair-token-mose-100k-s42",
    "TC-k1-pair-token-node-return-100k-s42",
    "TC-k1-pair-token-scale-attribution",
    "TC-k1-pairtoken-combination-transfer",
    "TC-k1-receiver-pair-100k-s42",
    "TC-k1-rrwp-pair-100k-s42",
    "TC-k1-rwse-refresh-100k-s42",
    "TC-k1-sparse-triplet-100k-s42",
    "TC-k1-spd-pair-token-100k-s42",
    "TC-k1-tf32-a100-paired-s42",
    "TC-k1-topology-portability-post100k-audit-s42",
    "TC-k1-triplet-aggregate-100k-s42",
    "TC-k1-v4-100k-reference-s42",
    "TS-v5-legacy-evidence-migration"
  ],
  "policy_id": "k1-relation-resolution-bounded-research",
  "policy_sha256": "5502ab5dabdce0e5a60979285b6994bb4d5f875ce2712f78231a94690756305b",
  "policy_version": "v1",
  "role_snapshot_refs": [
    "experiments/pcqm_k1_relation_resolution_100k/audit_role_plan.json"
  ],
  "source_commit": "f2d794f953af437af3fab60b33d49720531c7195",
  "source_hashes": {
    "experiments/pcqm_k1_relation_resolution_100k/audit_role_plan.json": "98b3a62ae85753fc9440fe5f4edd30d094e5460f652a14d6dfe38f900433ebed",
    "experiments/pcqm_k1_relation_resolution_100k/budget_snapshot.json": "1226e36c0133d6b8bbb4c4c30c43bfcc7fdfc4f1e5997d3e03c19ed784de6f0a",
    "experiments/pcqm_k1_relation_resolution_100k/protocol.md": "3608884c7c74a89dfd47bac816fc0f6dc2051ef51450b8804e67093615093e57",
    "experiments/pcqm_k1_relation_resolution_100k/training_contract.json": "47a82dd86fca1e1bbb7c18684e755dd1a973e97c9449672d61d02f274f7ba980",
    "experiments\\pcqm_gptrans_prenorm_500k_v5\\reference\\v5_evidence.json": "e7c0e42e5fddb935db5dc28b2ca1f01079250e65c85ce93c9e0187ea0deecc18",
    "experiments\\pcqm_gptrans_prenorm_500k_v5\\trajectory.json": "0f8c0e8b5b8a2186ca68d40f18929452828ee300c66b7ee6dc2140052ed66192",
    "experiments\\pcqm_gptrans_prenorm_500k_v5\\v5_evidence.json": "4fcd260bb8702feb699328c68e79db5e5e6d411bcdaee37eaa7a1b1c5a3b2508",
    "experiments\\pcqm_gptrans_shortest_path_profile_v5\\trajectory.json": "1bb53ac5f6a9e5deae53676eca262691ac0587db6e5045b4b99ccef50af85c99",
    "experiments\\pcqm_gptrans_shortest_path_profile_v5\\v5_evidence.json": "f5a05bf4a57680b626ce4f33093c660742c843d7147bd76ebe97747b0a08dd68",
    "experiments\\pcqm_gptrans_step_profile_v5\\trajectory.json": "19fe6f588ad078df83cb02ea0c8abbe94e5c99df4e32131933737be6ff0060b5",
    "experiments\\pcqm_gptrans_step_profile_v5\\v5_evidence.json": "f567e242cf9a174e56cb61a076472fe2b62fde10f9e91c43d5225c4d937c6020",
    "experiments\\pcqm_k1_chem_typed_pair_token_100k\\rml_finalized\\trajectory.json": "52d046723767b461b37a210da0030749c4d9fe3f40258c12b669561fcb9de284",
    "experiments\\pcqm_k1_chem_typed_pair_token_100k\\rml_finalized\\v5_evidence.json": "21154f272c2bd8fc5660cc0f1d50bdab161136e12fe74d234102baa2a60940f7",
    "experiments\\pcqm_k1_conjugated_hyperedge_100k\\arms\\oneshot\\rml_finalized\\trajectory.json": "b8b242ae18a5c04ec64d002dd9d8edb5c61c19cedc0acd787b104e4fd4bfc0bb",
    "experiments\\pcqm_k1_conjugated_hyperedge_100k\\arms\\oneshot\\rml_finalized\\v5_evidence.json": "65f7ab3037f1eb8b7bf1bac3965c9338692e813e1e9867394461d6c377e80246",
    "experiments\\pcqm_k1_conjugated_hyperedge_100k\\arms\\persistent\\rml_finalized\\trajectory.json": "e0edb155def65b7b0e443316a66cbff1bf25745b9ccf8a5af9231eef20af8362",
    "experiments\\pcqm_k1_conjugated_hyperedge_100k\\arms\\persistent\\rml_finalized\\v5_evidence.json": "ed7be2dcba02a32c62843177a15a0fbcc87ba86859faf404b21e5bfae084378b",
    "experiments\\pcqm_k1_cross_scale_frozen\\trajectory.json": "2f8fa0e2acd98e5338ffa03e4d7a6b1a9b1c538e84d5aa9f4fb7f20f3603a3af",
    "experiments\\pcqm_k1_cross_scale_frozen\\v5_evidence.json": "84a1797878348a1eecf1278e05815511a3aa32a8bc1bf2a655a3d237f078d4b1",
    "experiments\\pcqm_k1_functional_group_token_100k\\rml_finalized\\trajectory.json": "5a611c2264b268acc1ffb25f7a662c6e9723059607a21fb3f01273f46fbc9d39",
    "experiments\\pcqm_k1_functional_group_token_100k\\rml_finalized\\v5_evidence.json": "2953177136e9c4b0884e322c55eb01c966ff7a8a93a17e3ed0d3abc0da2642fc",
    "experiments\\pcqm_k1_linear_attention_100k\\audit_plan\\rml_finalized\\trajectory.json": "f1e650c3560648f1a9c6c2b877b434125008708418015f8f417df17a84f3fe58",
    "experiments\\pcqm_k1_linear_attention_100k\\audit_plan\\rml_finalized\\v5_evidence.json": "9be7faae5eb6e849fd5ad9cdc6a4ddd4c1bbcdfed7db8f85af4857211891dcf6",
    "experiments\\pcqm_k1_linear_attention_100k\\audit_recovery\\trajectory.json": "52e03666d2fc5d956d6771287c489543d11659fbb6ccb0aba20ed7ed976285ac",
    "experiments\\pcqm_k1_linear_attention_100k\\audit_recovery\\v5_evidence.json": "005540ac8f86cf7d7870fbdcd040290ebc054fb793ce9e0789de16aac27a5014",
    "experiments\\pcqm_k1_linear_attention_100k\\rml_plan\\rml_finalized\\trajectory.json": "c6dbcd2b5ae324892ca9e7be35bad11569de52b9471ae56fcfd26b52e0acfa17",
    "experiments\\pcqm_k1_linear_attention_100k\\rml_plan\\rml_finalized\\v5_evidence.json": "b6c8d980d0317f7d23679c384f10dc69b9c44c26fdb196de5f6f0a4d484e3218",
    "experiments\\pcqm_k1_mose_100k\\trajectory.json": "31fa702c01164901e1186cddb54a8b0e8c65cc584c3cf02e78ef168b1743f9a6",
    "experiments\\pcqm_k1_mose_100k\\v5_evidence.json": "000a5a173ffc4513dc5fb8dc2b7ade85eb602164411aba475a2b3c84abd87386",
    "experiments\\pcqm_k1_mose_context_gate_100k\\trajectory.json": "40e908d18df2828dd737c494d9afcc83a72be132c73c42dcfdfcb026d58ad0d5",
    "experiments\\pcqm_k1_mose_context_gate_100k\\v5_evidence.json": "df394c40df26fcc15de7c3775511b5d0caea353b51a26c48af5d74024bb1061f",
    "experiments\\pcqm_k1_mose_hidden_bn_100k\\trajectory.json": "c5990e8aab8f23a376379b512031818fb84a5cab7e21e5354c8986a4a346cfb9",
    "experiments\\pcqm_k1_mose_hidden_bn_100k\\v5_evidence.json": "5603266c5cf5a68b737180c617418c5fe4e54294397c6e8da8376440308d313b",
    "experiments\\pcqm_k1_mose_residual_gate_100k\\trajectory.json": "e12fa42d107a0a4d9eb23e985eff3fe086735de35789bc5538e1d3f3dd12cb7f",
    "experiments\\pcqm_k1_mose_residual_gate_100k\\v5_evidence.json": "def54495729ced0330bba2d365ca595da4b84d8e4fc0b96728a47f6c31be0506",
    "experiments\\pcqm_k1_multiplicative_pair_value_100k\\rml_finalized\\trajectory.json": "70620537d4f0b34dbc8f4cdc5ec6a0e90bcebc8c709cb0989efa5b76dcb42af4",
    "experiments\\pcqm_k1_multiplicative_pair_value_100k\\rml_finalized\\v5_evidence.json": "562ee2763213c591311113bf008a46926299bf018fdbfbf8a0530c26c130a7fe",
    "experiments\\pcqm_k1_oneshot_triplet_pair_token_100k\\rml_finalized\\trajectory.json": "d04dcef1c1abcf38bb6c58b11f3d42d7f67ee18d8cb3cab3ba875f467d26dee5",
    "experiments\\pcqm_k1_oneshot_triplet_pair_token_100k\\rml_finalized\\v5_evidence.json": "85d2b036353a7fe26e9ff122b5b8b48f1eb0b6d2b2f984b59ef03fd68e9d5db0",
    "experiments\\pcqm_k1_pair_token_100k\\trajectory.json": "f78b3444c5e0c091c693d9359baf0357fdec418d801f1a0f0b93ee9f8fce3852",
    "experiments\\pcqm_k1_pair_token_100k\\v5_evidence.json": "15b73a9c88cf5734033c2aea061fc6431d77a4b74a5b471f08f767643617bccb",
    "experiments\\pcqm_k1_pair_token_500k\\trajectory.json": "41932b04f848b7218303c111f18f17bd5467deda9cf99bad1eb223b4f93794f6",
    "experiments\\pcqm_k1_pair_token_500k\\v5_evidence.json": "c736e594b51c5ae2c90153fbdf76c3312d48ade91002fcc53f729b42e66eb9da",